99,,11.01.24 16:14,,,,1,1,2,11.01.24 16:14,27,2,1,,1,381,4,9,2,,,,,,,,,,,,0,11.01.24 16:20,5,6,6,5,4,5,7,1,If clothing restricted the space available,On the wrist,2,11.01.24 16:22,3,2,2,1,19,1,4,1,1,In anything that has a professional setting,"By the neck, on the collar of the clothing",2,11.01.24 16:23,1,1,1,1,1,1,1,3,In everyday as it looks unprofessional and would weigh down one side of the glasses,On the arm of a pair of glasses,2,11.01.24 16:24,2,1,4,2,1,1,3,1,2,That you would have to be wearing a hat which may be uncomfortable in some weathers and situations,On the rim of a hat,2,11.01.24 16:25,3,2,3,1,1,4,1,2,If this is uncomfortable as it is hanging around the neck,Around the lower part of the neck,2,11.01.24 16:26,4,3,4,2,3,5,3,1,"If it didn't work with the clothing that I was wearing, depending on how it fixes to the clothing","worn on the chest area, attached to the clothing",2,11.01.24 16:27,4,3,4,2,3,3,1,1,If it is swinging from side to side when completing activities and moving,"around the neck, as a necklace",2,11.01.24 16:28,3,4,3,1,1,5,3,2,If it is uncomfortable around the arm and if it is too cold and extra layers of clothing are required to go over that area,on the bicep,2,11.01.24 16:29,"Perhaps a wearable piece of jewellery, such as a ring or bracelet, that looks like a regular piece of jewellery.",None,2,11.01.24 16:29,2
100,,11.01.24 16:14,,,,1,1,2,11.01.24 16:15,61,2,1,,1,381,4,9,2,,,,,,,,,,,,0,11.01.24 16:19,6,6,6,6,6,6,7,4,Sleeping,A device that will track my exposure to light,2,11.01.24 16:22,4,3,5,3,19,3,5,2,3,Work,A device that will track my exposure to light,2,11.01.24 16:23,5,4,5,3,3,5,3,3,Work,To track exposure to light,2,11.01.24 16:27,5,4,4,5,3,3,6,3,2,Work,Tracks my exposure to light in the environment,2,11.01.24 16:28,5,4,6,3,4,6,3,1,Work,Tracks my exposure to light in the environment,2,11.01.24 16:29,5,5,6,4,5,6,4,1,Work,Tracks my exposure to light in the environment,2,11.01.24 16:30,5,6,6,3,5,6,4,1,Work,Tracks my exposure to light in the environment,2,11.01.24 16:31,5,5,6,3,5,6,3,1,None,Tracks my exposure to light in the environment,2,11.01.24 16:33,"No, I think the wrist one is the best",No,2,11.01.24 16:33,2
101,,11.01.24 16:14,,,,1,1,2,11.01.24 16:23,34,1,1,,1,381,4,9,2,,,,,,,,,,,,0,11.01.24 16:26,4,3,4,3,3,5,2,2,"Showering, swimming ","On the wrist, like a watch",2,11.01.24 16:28,3,4,4,4,19,4,4,3,3,"swimming, showering, whilst running, whilst not wearing clothes",attached to the neckline of clothing,2,11.01.24 16:30,3,3,3,3,3,3,2,2,any vigorous activities and showering/swimming,glasses worn over the eyes,2,11.01.24 16:31,4,5,4,3,3,4,5,3,2,"showering/swimming, any situation where wearing a hat isn't acceptable, for example in restaurants.",on the edge of a hat on the head,2,11.01.24 16:33,2,3,3,2,2,2,1,3,would just generally be irritating to wear,around the neck,2,11.01.24 16:34,4,5,5,5,5,5,6,1,"any occasions whilst not wearing clothes, e.g. showering",chest,2,11.01.24 16:35,4,4,5,4,4,2,5,2,exercise such as running,around the neck (like a necklace),2,11.01.24 16:37,3,2,3,2,2,4,1,3,anytime wearing multiple layers of clothes,around the upper arm,2,11.01.24 16:37,a smaller more discreet bracelet design or a ring worn on a finger,no,2,11.01.24 16:38,2
102,,11.01.24 16:15,,,,1,1,2,11.01.24 16:16,38,2,1,,1,381,3,9,2,,,,,,,,,,,,0,11.01.24 16:19,5,6,6,6,6,6,6,3,OUTSIDE WHEN THE SUN IS SHINING,ON THE WRIST,2,11.01.24 16:23,3,4,4,3,19,2,4,3,4,NONE,TACKED ON THE COLLAR OF THE T-SHIRT,2,11.01.24 16:27,4,5,4,5,4,2,3,4,"SLEEPING, BATHING, ETC",THE LIGHT LOGGER IS PLACED ON THE RIGHT SIDE OF THE GLASS FRAM,2,11.01.24 16:29,2,3,4,4,2,2,4,3,4,"AT WORK PLACE, SOCIAL CONTEXT ETC",THE LIGHT LOGGER IS PINNED ON THE HAT,2,11.01.24 16:31,5,5,5,4,4,5,5,2,NONE,THE LIGHT LOGGER IS WORN ON THE NECK,2,11.01.24 16:32,5,5,6,6,5,5,7,1,NONE,THE LIGHT LOGGER IS WORN AS A CHEST PIN,2,11.01.24 16:34,6,6,6,5,5,5,7,1,NONE,THE LIGHT LOGGER IS PLACED ON THE NECK LIKE A NECKLACE,2,11.01.24 16:36,4,4,5,2,4,5,5,1,NONE,THE LIGHT LOGGER IS PLACED ON THE SLEEVE,2,11.01.24 16:39,NONE.... ALL THE DESIGNS ARE GOOD BUT I WILL CHOOSE THE WRIST DESIGN,NO,2,11.01.24 16:40,2
103,,11.01.24 16:15,,,,1,1,2,11.01.24 16:15,46,2,1,,1,381,7,9,2,,,,,,,,,,,,0,,,,,,,,,,,,0,,,,,,,,,,,,,0,,,,,,,,,,,,0,,,,,,,,,,,,,0,,,,,,,,,,,,0,,,,,,,,,,,,0,,,,,,,,,,,,0,,,,,,,,,,,,0,,,,0,,0
104,,11.01.24 16:15,,,,1,1,2,11.01.24 16:16,65,2,1,,1,381,6,9,2,,,,,,,,,,,,0,11.01.24 16:22,4,6,6,6,6,6,7,1,"During very cold weather as in this circumstance, a coat would cover the device.     ",On the wrist,2,11.01.24 16:24,4,6,6,6,19,6,6,7,1,"During cold weather, as the device would be covered.",Attached to the collar,2,,,,,,,,,,,,0,,,,,,,,,,,,,0,,,,,,,,,,,,0,,,,,,,,,,,,0,,,,,,,,,,,,0,,,,,,,,,,,,0,,,,0,,0
105,,11.01.24 16:15,,,,1,1,2,11.01.24 16:16,46,1,1,,0,381,4,9,2,,,,,,,,,,,,0,11.01.24 16:18,4,4,1,1,1,4,2,7,Pretty much anytime. My skin is sensitive to wearables ,on the wrist,2,11.01.24 16:19,1,1,1,1,19,1,4,2,7,I just don't like it ,t-shirt ,2,11.01.24 16:19,1,1,1,1,1,1,1,7,I don't use glasses or anything on my face,face,2,11.01.24 16:20,1,1,4,1,1,1,2,1,7,I don't see myself using something on a beanie,beanie / hat,2,11.01.24 16:21,1,1,1,1,1,1,1,1,I don't like anything that restricts my movements ,shoulders / shirt ,2,11.01.24 16:22,1,1,1,1,1,1,1,1,anytime,shirt chest,2,11.01.24 16:22,1,1,1,1,1,1,1,1,anytime,around the neck ,2,11.01.24 16:23,3,4,4,1,1,5,2,2,on social occasions or at work,around arm,2,11.01.24 16:24,The around around the arm seems good or less intrusive,no,2,11.01.24 16:24,2
106,,11.01.24 16:15,,,,1,1,2,11.01.24 16:16,43,2,1,,1,381,4,9,2,,,,,,,,,,,,0,11.01.24 16:18,4,2,2,2,2,2,1,2,waashing.,on the wrist,2,11.01.24 16:19,3,1,1,1,19,1,1,1,2,none,neck,2,11.01.24 16:20,1,1,1,1,1,1,1,3,wearing a hat.,side of the head.,2,11.01.24 16:22,1,1,4,1,1,1,1,1,3,all.,side of head.,2,11.01.24 16:23,2,2,2,1,2,1,1,2,reaching heights.,shoulders,2,11.01.24 16:25,4,2,2,2,2,2,1,1,none,chest,2,11.01.24 16:26,2,1,1,1,1,1,1,1,general tasks.,around the neck,2,11.01.24 16:26,1,1,1,1,1,1,1,1,wasing,arm,2,11.01.24 16:27,no,no,2,11.01.24 16:27,2
107,,11.01.24 16:16,,,,1,1,2,11.01.24 16:16,31,2,1,,1,381,4,9,2,,,,,,,,,,,,0,11.01.24 16:18,2,2,2,2,1,1,1,6,"it looks very bulky, so most of the time. the gym would be difficult as would using tools ","it is placed on the wrist, above the joint",2,11.01.24 16:19,3,3,3,3,19,2,3,2,2,swimming would be a struggle!,it seems to clip onto ones shirt below the neck,2,11.01.24 16:20,3,1,4,4,1,1,3,2,"training at the gym, driving",the logger is attached to the arms of glasses worn on the face and over the eyes,2,11.01.24 16:21,4,4,4,3,4,4,1,3,2,it is not always possible to wear a hat and I find them uncomfortable for long periods of time. I do not train or relax in hats,the logger is attached to a hat worn on the head,2,11.01.24 16:22,4,3,5,5,2,4,4,2,showering or bathing,the logger is worn around the shoulders resting on the top of the torso,2,11.01.24 16:23,5,5,5,5,5,5,7,1,not many,the logger is outfitted to the shirt of the wearer on the front of the torso,2,11.01.24 16:26,4,3,5,5,3,3,4,2,it would be difficult to exercise as it would likely bounce against ones chest ,the logger is worn as a pendant around the neck,2,11.01.24 16:27,1,1,2,2,1,1,2,6,"training at the gym this looks restrctive, in addition it would likely rub against clothing when trying to type",the logger is worn as a band around the bicep,2,11.01.24 16:27,a belt clip,no,2,11.01.24 16:27,2
108,,11.01.24 16:18,,,,1,1,2,11.01.24 16:19,28,2,1,,1,194,4,9,2,,,,,,,,,,,,0,11.01.24 16:20,3,3,4,4,2,4,2,1,"I think just practically its a bit of a waste, I'd much rather wear a smart watch on my wrist with other features",on the left wrist,2,11.01.24 16:21,2,1,3,2,19,1,1,1,1,Any social situation it looks so out of place and strange,Attached to the collar of the shirt,2,11.01.24 16:22,1,1,2,1,1,1,1,3,Any physical or social activity,Attached to the glasses,2,11.01.24 16:22,1,1,4,1,1,1,1,1,4,Anything that involves physical activity,On a hat,2,11.01.24 16:25,1,1,1,1,1,1,1,5,"Any situation, seems so cumbersome and pointless",Around the neck,2,11.01.24 16:26,3,2,5,3,2,2,3,2,Would be difficult during exercise,Pinned to shirt in chest area,2,11.01.24 16:26,1,1,1,1,1,1,1,6,Doing anything ,Like a necklace,2,11.01.24 16:29,2,2,3,1,1,1,2,3,"Exercising, in work with uniform ",Armband,2,11.01.24 16:29,No,n/a,2,,0
109,,11.01.24 16:28,,,,1,1,2,11.01.24 16:29,18,1,1,,1,381,7,9,2,,,,,,,,,,,,0,11.01.24 16:31,5,5,6,5,4,4,7,2,swimming,wrist,2,11.01.24 16:34,3,3,4,2,19,1,1,4,2,excercise,collar,2,11.01.24 16:35,1,1,3,1,1,1,3,2,In social settings,on glasses.,2,11.01.24 16:36,4,4,4,4,3,2,3,2,1,none,Hat on head.,2,11.01.24 16:38,3,1,1,1,1,1,1,4,Any situation that involves moving.,Over shoulders,2,11.01.24 16:38,5,6,5,5,5,5,7,1,none,chest.,2,11.01.24 16:39,1,1,4,1,1,1,3,1,none.,Around neck.,2,11.01.24 16:41,5,5,4,3,1,5,3,1,none.,around the arm,2,11.01.24 16:42,A little pin on the arm sleeve.,"no, thank you.",2,11.01.24 16:42,2
110,,[not completed],,,,0,0,0,,,,,,,,,,0,,,,,,,,,,,,0,,,,,,,,,,,,0,,,,,,,,,,,,,0,,,,,,,,,,,,0,,,,,,,,,,,,,0,,,,,,,,,,,,0,,,,,,,,,,,,0,,,,,,,,,,,,0,,,,,,,,,,,,0,,,,0,,0
111,,12.01.24 12:01,,,,1,1,2,12.01.24 12:02,24,2,1,,0,291,1,9,2,,,,,,,,,,,,0,12.01.24 12:03,5,4,4,4,4,4,5,2,In washing the dishes ,on the wrist,2,12.01.24 12:05,3,2,2,2,19,2,2,2,1,The placement is weird I think that it could be suspicious for other people around me that it is a microphone or camera.,"pinned to a collar, close to the neck",2,12.01.24 12:06,3,3,3,3,3,3,2,1,"In driving a car, I don't use glasses",on my face as a glasses,2,12.01.24 12:07,3,3,4,3,3,3,3,2,1,at home I usually don't wear a beanie,on the beanie/head,2,12.01.24 12:08,3,3,3,3,3,3,2,1,in the shower,around my neck,2,12.01.24 12:10,4,4,4,4,4,3,6,3,It could be difficult in the winter when you wear many layers on it,on the pocket of the t-shirt,2,12.01.24 12:10,2,2,2,2,2,1,1,1,during some exercises,hanging on my chest,2,12.01.24 12:11,3,2,2,2,2,5,3,2,at work,around my biceps,2,12.01.24 12:12,maybe on the shoes?,not really,2,,0
112,,12.01.24 12:02,,,,1,1,2,12.01.24 12:02,25,1,1,,0,291,4,9,2,,,,,,,,,,,,0,12.01.24 12:08,3,4,5,4,2,5,6,3,Mostly during some social events. Some parties or meetings when I'd put some effort to look pretty the light logger might not work with outfit,It would be placed on the wrist,2,12.01.24 12:13,3,3,5,4,19,3,5,5,2,Social events and work - I think it might look a bit like a forgotten laundry peg,By the neck,2,12.01.24 12:21,4,5,5,5,5,4,7,1,Since these are glasses I thinik that wearing them during some excercising might be difficult since they might fall ,Face,2,12.01.24 12:31,5,5,4,2,2,3,2,3,2,Since I'd have to wear a hat to use the device I think it would be overall difficult,On the head (on hat),2,12.01.24 12:41,5,5,6,5,4,5,7,1,Some of the social activities,By the neck,2,12.01.24 12:48,4,6,6,6,5,5,7,1,Some social events or meetings,On the chest,2,12.01.24 12:51,5,6,6,6,6,6,7,1,Propably some social events with certain dresscode or during some sort of excercises,Between neck and chest,2,12.01.24 12:54,3,5,5,4,3,5,5,2,Mostly during some social events ,On the biceps,2,12.01.24 12:55,Nothing really crosses my mind right now,No,2,12.01.24 12:55,2
113,,12.01.24 12:02,,,,1,1,2,12.01.24 12:04,56,2,1,,1,168,3,9,2,,,,,,,,,,,,0,12.01.24 12:08,6,6,6,6,6,3,6,2,While lifting weights or sitting in a sauna.,I looks like a smart watch and is worn on the wrist.,2,12.01.24 12:12,6,6,6,6,19,6,3,6,3,In any situation where exercise makes it a hinderance.  Also if I have to take my shirt off.,It seems to be a clip which attaches to the collar of your shirt.,2,12.01.24 12:17,3,3,5,5,3,1,4,6,I generally only wear glasses to read.  Any time I am not reading I don't wear them.  So they would only be useful while reading.  At any other time I would have to take them off because they seem a little cumbersome.,The light logger in located on glasses which are worn on the face.,2,12.01.24 12:20,5,5,4,3,3,4,3,4,3,"It requires that you wear a hat, which I only do on cold days and mostly outdoors.  I would not wear it indoors very often which would probably defeat the purpose.",It is located on a hat and worn on the head.,2,12.01.24 12:24,6,6,7,6,6,6,6,2,Probably while I am in a reclined position or jumping around for exercise.  ,It is worn like around the neck.,2,12.01.24 12:28,7,7,7,7,6,6,6,1,Only in any activity which requires that I must remove my shirt.  Otherwise I think it would be easy to wear most of the day.,It seems to be in the form of a pin which attaches to your shirt and is worn over the chest.,2,12.01.24 12:31,6,6,7,7,6,6,6,1,While jogging it might be a little annoying to have this bouncing around.,It is worn over the chest and attached like a necklace. ,2,12.01.24 12:34,5,5,6,5,6,7,7,1,"If I am wearing layered long sleeve clothing it would have to be worn above the clothes, which could feel a little restricting.",It is an arm band worn over your arm.,2,12.01.24 12:36,"Depending on the size, the sensor, it could be worn as a ring around the finger.  ",No other comments.,2,12.01.24 12:37,2
114,,12.01.24 12:02,,,,1,1,2,12.01.24 12:03,34,1,1,,0,294,4,9,2,,,,,,,,,,,,0,12.01.24 12:06,4,5,5,5,4,5,4,1,"It looks a lot like a normal watch, so no activities come to mind, I wear a smartwatch at the gym for example, and even to sleep I've done it before.",Place it on the wrist like a watch.,2,12.01.24 12:08,4,5,6,6,19,5,3,5,2,I fear it may fall down during physical activities.,It's placed on the neckline of the shirt like a clip on accessory,2,12.01.24 12:09,2,1,1,1,1,1,1,5,"Apart from sunglasses, I don't wear glasses to see, so it would be rather difficult for me to use that logger.",Attached to the side of a pair of glasses.,2,12.01.24 12:11,3,3,4,2,2,1,1,1,1,"I mean, I only wear hats in the winter when it's really cold and I have to go outside. I don't use them inside buildings and so on. Therefore it would be difficult for me to wear that on a daily basis.",Clipped to a hat.,2,12.01.24 12:13,3,3,3,3,1,4,2,1,Nothing comes to mind.,It's placed like a collar on the top/shirt the person is wearing.,2,12.01.24 12:14,4,5,5,5,4,5,4,1,NOthing comes to mind.,Used like a brooch on a top/shirt,2,12.01.24 12:15,3,3,4,3,1,4,3,1,Nothing comes to mind,Worn like a necklace.,2,12.01.24 12:16,4,5,6,5,2,7,3,1,When taking a shower or going to sleep.,"Around the upper arm, like a band.",2,12.01.24 12:17,No,No,2,12.01.24 12:17,2
115,,12.01.24 12:02,,,,1,1,2,12.01.24 12:03,26,2,1,,0,137,4,9,2,,,,,,,,,,,,0,12.01.24 12:05,5,6,4,5,5,6,5,2,"swimming, working out",on a wrist,2,12.01.24 12:07,3,2,4,2,19,2,4,4,3,"in work, public meetings or visiting someone, because they might think it is a recording device and might make them feel unsecure","clipped to shirt, near neck",2,12.01.24 12:09,3,1,4,1,2,2,1,3,"in most of the daily activities or situations, it might also be really useless for people, who do not wear glasses. Having glasses during any sport is a difficulty.",on a side of the glasses,2,12.01.24 12:11,5,5,4,1,1,3,5,3,5,when the weather is sunny or just in no need of having someone wear a cap,on a side of a cap,2,12.01.24 12:12,6,5,4,6,6,5,5,2,"while working out, because i think it might fall down",around a neck,2,12.01.24 12:14,5,5,5,5,5,5,5,1,none,"front of a shirt, same place as pocket is used to be",2,12.01.24 12:15,6,6,6,6,7,5,7,2,maybe running,as necklace,2,12.01.24 12:16,7,7,7,7,7,7,6,1,none,upper arm,2,12.01.24 12:18,I really liked the last one - on upper hand. I believe all possible alternatives were already shown.,no,2,12.01.24 12:18,2
116,,12.01.24 12:02,,,,1,1,2,12.01.24 12:04,81,1,1,,0,291,6,9,2,,,,,,,,,,,,0,12.01.24 12:06,3,4,4,4,4,3,4,2,Nie ma takich sytuacji ,"Nie rozumiem polecenia,ale wydaje mi si e mam opisa noszenie zegarka na doni",2,12.01.24 12:07,5,3,5,5,19,5,5,7,1,Nie mam zdania ,Nie mam zdania ,2,12.01.24 12:07,4,4,4,3,4,5,3,4,Nie byo by ,Nie mam zdania ,2,12.01.24 12:08,4,4,4,3,4,4,5,3,4,Nie mam zdania ,Nie mam zdania ,2,12.01.24 12:09,4,5,4,3,5,6,3,2,nie ma takich sytuacji ,Nie rozumiem pytania i nie mam zdania na ten temat,2,12.01.24 12:10,3,3,3,3,4,3,2,2,Nie jest trudne ,Nie mam zdania ,2,12.01.24 12:11,5,5,3,7,5,4,6,3,Nie jest trudne ,I  nie mam owego zdania na ten temat ,2,12.01.24 12:12,3,4,4,4,4,1,4,7,moim zdaniem nie ,Nie mam zdania,2,12.01.24 12:13,Nie mam takich moliwo i nie jestem na tyle kreatywna eby co takiego wymyle bd opracowa Ale moja propozycja jest nastpujca rejestrotor na nodze bd udzie,Nie mam ,2,12.01.24 12:14,2
117,,12.01.24 12:03,,,,1,1,2,12.01.24 12:03,43,2,1,,0,197,4,9,2,,,,,,,,,,,,0,12.01.24 12:04,5,5,5,5,5,4,7,1,shower?,on the wrist,2,12.01.24 12:06,4,4,5,4,19,3,2,4,3,"doing sport, running, business meeting, in the summer at beach",attached shirt collar,2,12.01.24 12:07,3,2,2,2,1,3,2,3,"running, sports, business",attached to the glasses,2,12.01.24 12:08,2,2,4,4,1,1,1,2,5,"running, business hours, social context, at the beach, during warm months",pinned to the hat,2,12.01.24 12:09,4,4,4,4,3,3,3,5,"when doing sports, in social context, during business meeting",it is looped to the neck,2,12.01.24 12:10,4,5,6,5,5,5,6,1,elegant occasions,pinned to the chest on shirt,2,12.01.24 12:11,5,5,5,4,4,3,4,3,"elegant dressing, intensive sport, at the beack",as necklace,2,12.01.24 12:12,2,2,2,3,2,4,3,3,"during cold monts, situations with elegant dressing, at the beach in the summer",as sleeve collar,2,12.01.24 12:13,"nope, the best one is for sure integrating it in a smartwatch","nope, it was interesting",2,12.01.24 13:00,2
118,,12.01.24 12:03,,,,1,1,2,12.01.24 12:04,22,1,1,,0,294,3,9,2,,,,,,,,,,,,0,12.01.24 12:06,5,5,5,6,3,7,7,1,"When going out, depending on the design, it can be hard to make it look good.",Wrist,2,12.01.24 12:08,3,4,3,3,19,1,6,3,1,"It's not too discrete, and wouldn't generaly want to walk around with that hanging on me.",Chest (clasped to a shirt),2,12.01.24 12:09,5,4,3,5,3,3,3,3,"Glasses don't fit every event, and for people who don't wear them regularly, it's a strange design to adapt to",Face (glasses),2,12.01.24 12:10,1,1,4,2,1,1,3,1,3,Not everyone likes wearing headwear. And the head is a weird placement for a gadget that looks somehwat big.,Head (beanie),2,12.01.24 12:11,5,5,5,2,1,7,3,2,"Bending and other movements might be affected by this, since it probably woudln't stick to the body so you could forget it was there",Shoulders/chest,2,12.01.24 12:12,7,7,7,7,7,7,7,1,"None, really (if it is sewing in and light/invisible, like it looks in the example)",Chest (shirt),2,12.01.24 12:14,5,7,7,7,7,7,7,7,"As long as it isn't bulky and is a discrete necklace, I don't see a situation where it would be hard to wear; if it is bulky and obvious, it's porbably not the best to wear to some social contexts.",Chest (necklace),2,12.01.24 12:15,5,3,2,1,1,7,3,1,"Social contexts, since it looks too 'gadgety'",Arm,2,12.01.24 12:16,"Integration on things we already wear (hence why the watch would work so well): other jewelry like rings, necklaces, etc. Or even an attachment you can add to your bags/carabiner.",I liked it.,2,12.01.24 12:16,2
119,,12.01.24 12:03,,,,1,1,2,12.01.24 12:04,28,1,1,,0,291,4,9,2,,,,,,,,,,,,0,12.01.24 12:06,5,4,5,5,4,5,6,5,"when taking shower, at the swimming pool, during sleeping",wrist band,2,12.01.24 12:08,4,5,5,5,19,4,6,7,1,at formal events,at the collar of a shirt,2,12.01.24 12:10,3,2,2,2,2,1,1,6,"during hot or rainy weather, during sleep, during takig a showers, during napping etc",at the side of glasses,2,12.01.24 12:12,2,2,4,1,1,1,2,2,6,during all of the indoor activites and daily tasks,on the side of the cap/head,2,12.01.24 12:13,1,1,1,1,1,3,2,7,"workplace, social events, sleeping",around the neck,2,12.01.24 12:15,4,5,5,5,4,5,6,2,during sleeping,at the chest,2,12.01.24 12:16,4,4,5,4,3,3,5,4,"during physical work it would be annoying, during sleep",hanging around the neck ,2,12.01.24 12:18,5,4,5,4,3,6,6,1,"wearing more clothes than just a t-shirt, during formal social events",around the arm,2,12.01.24 12:22,maybe on the forearm in a form of orginally designed bracelet,nope,2,12.01.24 12:22,2
120,,12.01.24 12:03,,,,1,1,2,12.01.24 12:04,22,2,1,,0,185,4,9,2,,,,,,,,,,,,0,12.01.24 12:08,4,4,4,4,4,1,3,2,During exercise or a work when it's dangerous to wear it.,wrist,2,12.01.24 12:10,4,5,5,5,19,5,5,7,1,During sleep,On your clotheing,2,12.01.24 12:12,1,1,1,1,1,1,1,5,During the day,On your head,2,12.01.24 12:14,3,3,4,1,2,3,1,2,2,When you did't want to wear a hat,On your head,2,12.01.24 12:22,3,2,2,2,2,2,1,2,I would be just anoying,Neck,2,12.01.24 12:24,4,5,5,5,5,5,7,2,If somethong can rip of my t-shirt,chest,2,12.01.24 12:34,4,3,3,3,3,1,3,4,During exercise,neck,2,12.01.24 12:35,3,3,3,4,3,3,2,2,I don't know,arm,2,12.01.24 12:37,A ring maybe.  The chest pin was the best in m opinion.,No,2,12.01.24 12:37,2
121,,12.01.24 12:03,,,,1,1,2,12.01.24 12:04,18,2,1,,0,164,1,9,2,,,,,,,,,,,,0,12.01.24 12:06,1,2,3,1,1,4,2,3,At locations were a dresscode is important ,The light logger is palced at the arm near to the Hand. ,2,12.01.24 12:07,1,1,1,1,19,1,2,1,1,Everywhere because everybody sees it and you can't hide it ,The light logger is placed in the middle top of ur T-shirt ,2,12.01.24 12:08,2,3,5,3,2,1,4,1,"Maybe at sport activities because glasses can easily break there (soccer, handball) ","The light logger is placed at the top of ur nose, like glasses ",2,12.01.24 12:10,2,2,4,5,4,3,4,4,1,When you don't have something on ur head where u can pin it. ,It is placed at ur head with a cap or other headdress ,2,12.01.24 12:11,3,2,5,2,1,5,3,2,In Situations where u just sit down or lying and it presses on ur bones ,It is placed over the neck and shoulders ,2,12.01.24 12:12,4,5,6,5,4,5,5,1,Maybe when you are moving so it can't hold on the shirt ,The light logger is placed at ur upper body pinned on ur T-Shirt ,2,12.01.24 12:15,4,5,7,5,6,5,7,1,At some sports activities it would be difficult ,It is hanging around ur neck ,2,12.01.24 12:16,1,1,2,2,1,3,1,2,When u do something with ur arms and its too closely ,at ur upper arm biceps ,2,12.01.24 12:17,Maybe as an earring for people who can wear it ,"Maybe improve the layout, it was buggy sometimes ",2,,0
122,,12.01.24 12:03,,,,1,1,2,12.01.24 12:04,18,1,1,,0,291,1,9,2,,,,,,,,,,,,0,12.01.24 12:08,4,4,5,3,3,5,4,5,When it wouldn't fit my outfit ,On the wrist,2,12.01.24 12:09,6,6,3,5,19,5,4,6,2,when you are going to wear a scarf or jewellery ,"under neck, on the part of the T-shirt",2,12.01.24 12:11,1,3,3,3,2,1,1,7,Cause some of the people don't wear glasses at all,The light logger is placed on the glasses,2,12.01.24 12:13,3,3,4,3,3,4,1,2,4,"Cause this hat with light logger can fit more for men, than for woman",The light logger is placed on the left side of the hat,2,12.01.24 12:14,6,5,4,6,7,4,5,1,It doesn't look like a casual outfit,The light logger is placed around the neck,2,12.01.24 12:17,7,7,6,6,6,4,6,1,I can't find a situation where it can be difficult,The light logger is placed on the T-shirt,2,12.01.24 12:19,3,3,2,3,4,1,2,6,"Cause it looks like difficult to wear, and looks  more like accessories for a few events",The lighter body is like the neckless on a T-shirt,2,12.01.24 12:21,2,3,1,1,1,1,1,7,It can be difficult in winter or just in cold weather,The light logger is placed on the arm,2,12.01.24 12:22,"Combine light sensors with other biometric sensors (e.g., heart rate, temperature) to provide a more comprehensive health monitoring solution.",Use biocompatible materials to ensure comfort and reduce the risk of skin irritation.,2,12.01.24 12:23,2
123,,12.01.24 12:03,,,,1,1,2,12.01.24 12:04,24,2,1,,0,197,1,9,2,,,,,,,,,,,,0,12.01.24 12:07,5,6,4,5,6,3,6,1,cooking,light logger is in the same position of clock on the wrist,2,12.01.24 12:08,4,5,7,6,19,5,7,7,1,none,"logger is placed on the T-shirt, next to the neck",2,12.01.24 12:10,3,5,2,3,5,3,3,1,if I play contact sports such as basket,on the left side of glasses,2,12.01.24 12:11,4,5,4,6,5,6,6,5,1,none,"logger is at the end of the hat, next eyes",2,12.01.24 12:12,5,6,6,5,5,5,6,1,none,"logger is on the T-shirt, around the neck",2,12.01.24 12:13,6,7,7,7,7,7,7,1,none,logger is on the left part of the chest,2,12.01.24 12:15,5,6,6,6,6,4,6,1,none,logger is around the neck,2,12.01.24 12:16,4,4,6,5,4,5,7,1,none,it's around the upper part of my arm,2,12.01.24 12:18,On the visor of the cap,-,2,12.01.24 12:18,2
124,,12.01.24 12:03,,,,1,1,2,12.01.24 12:04,23,2,1,,0,197,3,9,2,,,,,,,,,,,,0,12.01.24 12:06,4,6,6,6,4,5,7,1,I don't think it might be difficult,Like a watch,2,12.01.24 12:08,3,3,5,5,19,2,4,6,2,It might fall off during some activity that requires a lot of movement,Clipped to the edge of the shirt,2,12.01.24 12:10,4,4,5,5,2,3,5,3,"During activities that require movement, the placement seems to be heavy",Mounted on glasses,2,12.01.24 12:11,5,5,4,3,5,3,4,4,2,Being indoor,Mounted on the hat,2,12.01.24 12:12,1,1,3,2,1,1,3,4,Not being sit,Around the neck,2,12.01.24 12:13,4,3,5,5,2,3,5,1,I don't think it can cause problems,Pinned to the chest,2,12.01.24 12:13,4,5,6,4,2,2,5,4,"Running, moving a lot",Mounted on a necklace,2,12.01.24 12:14,1,1,1,2,1,1,2,4,"I think it might be uncomfortable, so in every situation",As a sleeve,2,12.01.24 12:15,"I think the clock one is the most practical, in particular if it can implement the clock funcion",No,2,,0
125,,12.01.24 12:03,,,,1,1,2,12.01.24 12:04,42,2,1,,0,351,4,9,2,,,,,,,,,,,,0,12.01.24 12:07,3,2,4,2,3,6,3,1,sport practice like climbing or swimming,wrist,2,12.01.24 12:08,3,4,5,2,19,1,6,3,2,when shirtless,collar,2,12.01.24 12:09,1,1,1,1,1,1,1,7,any situation,face,2,12.01.24 12:11,3,2,4,1,1,1,1,1,4,when it's hot outside,head,2,12.01.24 12:13,4,5,4,1,2,5,3,1,in office,neck,2,12.01.24 12:14,5,5,5,4,4,5,4,1,when shirtless,chest,2,12.01.24 12:15,4,4,3,2,3,5,3,1,outdoor sport practice like rock climbing,chest,2,12.01.24 12:16,5,5,5,5,4,6,4,1,in office outfit,arm,2,12.01.24 12:20,small waterproof sticker ,great idea specialy for long time sun exposure in outdoor activities ,2,,0
